{
  "plugin": "PCGExElementsClustersSketch",
  "version": "0.1",
  "aliases": {
    "FPCGExClusterSketchCollectionEntry": "UPCGExClusterSketchCollection"
  },
  "enums": {
    "EPCGExAttributeFilter": {
      "values": [
        {
          "name": "All",
          "display_name": "All",
          "tooltip": "All elements"
        },
        {
          "name": "Exclude",
          "display_name": "Exclude",
          "tooltip": "Discard listed elements, keep the others"
        },
        {
          "name": "Include",
          "display_name": "Include",
          "tooltip": "Keep listed elements, discard the others"
        }
      ]
    },
    "EPCGExClusterSketchSource": {
      "values": [
        {
          "name": "CollectionMap",
          "display_name": "Collection Map",
          "tooltip": "Resolve each target's sketch from a staged pick, through a Collection Map. Requires points staged by a distribution node."
        },
        {
          "name": "Asset",
          "display_name": "Asset",
          "tooltip": "Resolve each target's sketch from a direct asset reference -- a constant, or a per-point path attribute."
        }
      ]
    },
    "EPCGExInputValueType": {
      "values": [
        {
          "name": "Constant",
          "display_name": "Constant",
          "tooltip": "Use a constant, user-defined value."
        },
        {
          "name": "Attribute",
          "display_name": "Attribute",
          "tooltip": "Read the value from the input data."
        }
      ]
    },
    "EPCGExPropertyOutputMode": {
      "values": [
        {
          "name": "AllFound",
          "display_name": "All Found",
          "tooltip": "Output every property the source carries. Output attribute names match property names."
        },
        {
          "name": "Explicit",
          "display_name": "Explicit",
          "tooltip": "Use the Property Output Settings to pick which properties to output and rename them."
        }
      ]
    },
    "EPCGExSketchActorSource": {
      "values": [
        {
          "name": "Selector",
          "display_name": "Actor Selector",
          "tooltip": "Find actors in the level with the standard PCG actor selector."
        },
        {
          "name": "Input",
          "display_name": "Input References",
          "tooltip": "Read actor references from an input pin -- an attribute set or point data."
        }
      ]
    },
    "EPCGExStringMatchMode": {
      "values": [
        {
          "name": "Equals",
          "display_name": "Equals",
          "tooltip": "The tested value is the query, ignoring case."
        },
        {
          "name": "Contains",
          "display_name": "Contains",
          "tooltip": "The tested value contains the query anywhere in it, ignoring case."
        },
        {
          "name": "StartsWith",
          "display_name": "Starts with",
          "tooltip": "The tested value begins with the query, ignoring case."
        },
        {
          "name": "EndsWith",
          "display_name": "Ends with",
          "tooltip": "The tested value ends with the query, ignoring case."
        },
        {
          "name": "Matches",
          "display_name": "Matches",
          "tooltip": "Wildcard matching. Supports * or ? as wildcards."
        }
      ]
    }
  },
  "entries": {
    "UPCGExClusterSketchCollection": {
      "id": "UPCGExClusterSketchCollection",
      "name": "Collection | Cluster Sketch",
      "plugin": "PCGExElementsClustersSketch",
      "module": "PCGExElementsClustersSketch",
      "classification": "asset",
      "covers": [
        "FPCGExClusterSketchCollectionEntry"
      ],
      "purpose": "A collection whose entries are Cluster Sketch assets, so hand-authored clusters distribute with the same weighted machinery as any other staged asset. An entry names a sketch, or flips to a sub-collection of any type; a distribution node picks one per point, and Staging : Load Sketch prints what was picked. A level export fills rows too: a Cluster Sketch component met in a captured level or actor subtree becomes a point on the export's Sketches pin, backed by a row in the shared sketch collection the host maintains, referencing the component's asset or holding an export-owned copy of its inline sketch.",
      "situation": "Hand-authored structural pieces have to be picked per point, weighted and categorized like a library of meshes.",
      "mechanism": {
        "text": "Entries travel the distribute and swap pipeline unmodified through the same type-blind transport as every other collection, so weighted picks, category filtering, collection maps and sub-collection recursion all behave as standard. What is sketch-specific is the staging bounds: a rebuild measures each entry from the sketch model itself, resolving lattice-bound vertices through the sketch's snap provider, with the assets a sketch references loaded first so nested dependencies resolve before measuring. A staged pick therefore fits and justifies like any other asset, with nothing spawnable behind it until Load Sketch prints. An inline row measures its export-owned copy the same way, and Load Sketch prints the copy as it would an asset."
      },
      "off_label": [
        {
          "claim": "Sketch entries host inside Omni collections next to meshes, actors and levels: dragging sketch assets into an Omni grid resolves them to this entry type, and a sketch pick that reaches a non-sketch consumer flows past it untouched.",
          "grounded_in": "The editor type registry's DetectSourceAsset routes UPCGExClusterSketch assets to this entry type, and Staging : Load Sketch treats non-sketch picks as expected rather than failed"
        }
      ],
      "settings": {
        "Entries": {
          "display": "Entries",
          "type": "TArray<FPCGExClusterSketchCollectionEntry>",
          "see": "FPCGExClusterSketchCollectionEntry",
          "semantics": "The only type-specific field a hand-authored row exposes is Sketch; entries carry no descriptor block and the collection no type-level globals, because the sketch itself is the whole payload. Source is read-only: a row you add references an asset, and only a level export produces Inline rows, whose copy is not exposed for editing. The copy is not edited in the collection: the component is where the sketch is authored, and re-exporting refreshes the row."
        }
      },
      "inherits": [
        "UPCGExAssetCollection"
      ],
      "hints": [
        {
          "style": "info",
          "text": "A staged sketch pick produces a cluster at execute time, through Staging : Load Sketch; there is no mesh or actor behind the entry.",
          "anchor": "whats_it_for"
        },
        {
          "style": "info",
          "text": "An inline row is identified by a checksum of its content, the way a mesh row is by its mesh and component settings. Components carrying identical inline sketches collapse into one shared row, and editing a component changes the checksum, so a re-export replaces the row instead of adding one.",
          "anchor": "Entries"
        }
      ],
      "related": [
        {
          "path": "working-with-cluster-sketch/printing.md",
          "url": "https://pcgex.gitbook.io/pcgex/cluster-sketch/working-with-cluster-sketch/printing"
        },
        {
          "path": "node-library/staging-load-sketch.md",
          "url": "https://pcgex.gitbook.io/pcgex/cluster-sketch/node-library/staging-load-sketch"
        }
      ],
      "url": "https://pcgex.gitbook.io/pcgex/cluster-sketch/node-library/cluster-sketch-collection",
      "source": {
        "file": "PCGExElementsClustersSketch/Public/Collections/PCGExClusterSketchCollection.h",
        "hash": "5a2b9a0e1f163eee050de3cfdaead52f67224dfe"
      }
    },
    "UPCGExGetSketchDataSettings": {
      "id": "UPCGExGetSketchDataSettings",
      "name": "Get Sketch Data",
      "plugin": "PCGExElementsClustersSketch",
      "module": "PCGExElementsClustersSketch",
      "classification": "node",
      "purpose": "Reads PCGEx Cluster Sketch components off actors and prints each one as a cluster, placed by the component's world transform, so the output matches 1:1 what is authored and visible in the level. Sketches carrying sites also emit them as plain points on their own pin, ready to seed Find Cells.",
      "situation": "Sketches were authored on actors in the level, and a graph needs them as clusters exactly where they sit.",
      "mechanism": {
        "text": "Actors are found, their sketch components collected, and each component's sketch in force (inline payload, own asset, or class default) is snapshotted on the game thread so the print runs off-thread against a stable copy. Each snapshot then prints one Vtx / Edges pair through the shared sketch print path, transformed by its component's world transform; the only thing this node adds over the asset's own print is discovery and placement.",
        "steps": [
          "Find actors: the standard PCG actor selector, or actor references read from the References pin.",
          "Collect their Cluster Sketch components, narrowed by the Component Selector; components PCG itself spawned are skipped by default.",
          "Snapshot each component's sketch and basis on the game thread.",
          "Print one cluster per snapshot, writing authored sketch properties as attributes and the source actor as a @Data attribute.",
          "Print sites as plain points on the Sites pin, independent of whether the cluster itself printed."
        ]
      },
      "off_label": [
        {
          "claim": "A sketch holding only sites still emits its Sites data, so a component can serve purely as an authored seed cloud with no printable cluster behind it.",
          "grounded_in": "FPCGExClusterSketchPrint prints sites synchronously before the cluster compile and the node stages SiteIOs even when the Vtx output is rolled back with EIOInit::NoInit"